uuid,category,brand,title,age,classification,content,nutrient,info,gram,calory,ingredient,from_company,img,soup
447,고양이,파미나 (FARMINA),로우그레인 치킨&석류,"키튼,어덜트,시니어,전연령",건사료,"얼리지 않은 뼈를 제거한 닭고기(24%), 수분을 제거한 닭고기(24%), 통스펠트(10%), 통귀리 (10%), 닭고기 지방, 수분을 제거한 달걀(4.5%), 얼리지 않은 청어(2.7%), 수분을 제거한 청어(2.5%), 청어 오일, 건조 비트 펄프, 완두콩 섬유소, 건조 당근, 건조 알팔파, 이눌린, 프락토올리고당, 이스트 추출물(만난올리고당의 원료), 건조 석류(0.5%), 건조 사과, 건조 시금치, 차전자피(0.3%), 건조 스위트 오렌지, 건조 블루베리, 소금, 건조 맥주효모, 강황(0.2%), 비타민 A, 비타민 D3, 비타민 E, 아스코르브산(수용성 비타민 C), 나이아신(수용성 비타민 B3), 판토텐산 칼슘(수용성 비타민 B5), 리보플라빈(수용성 비타민 B2), 피리독신 염산염(수용성 비타민 B6), 티아민(수용성 비타민 B1), 비오틴(수용성 비타민 H), 엽산(수용성 비타민 B9), 비타민 B12, 염화콜린, 베타카로틴, 아연 아미노산(메티오닌) 킬레이트, 망간 아미노산(메티오닌) 킬레이트, 철분 아미노산(글리신), 구리 아미노산(메티오닌) 킬레이트, DL- 메티오닌, 타우린(4000mg/kg 이상), 정제하고 가수분해한 닭연골(글루코사민 (1200mg/kg이상)과 콘드로이틴 황산(900mg/kg이상)의 원료), 알로에 베라겔, 녹차 추출물, 로즈마리 추출물, 혼합토코페롤(천연 항산화제)",조단백 36%  조지방 20%  칼슘 1.1%  인 0.9%  수분 8%,비유전자변형,1.5kg,"4,383 kcal/kg","신선한 뼈없는 닭, 수분을 제거한 닭고기, 스펠트",이탈리아/RUSSO MANGIMI S.p.A,https://cdn.purplesto.re/media/store/sale/main_image/farmina_cat_B039CF01_thumb01_ha6UAzs.png,"파미나 (FARMINA) 로우그레인 치킨&석류 건사료 얼리지 않은 뼈를 제거한 닭고기(24%), 수분을 제거한 닭고기(24%), 통스펠트(10%), 통귀리 (10%), 닭고기 지방, 수분을 제거한 달걀(4.5%), 얼리지 않은 청어(2.7%), 수분을 제거한 청어(2.5%), 청어 오일, 건조 비트 펄프, 완두콩 섬유소, 건조 당근, 건조 알팔파, 이눌린, 프락토올리고당, 이스트 추출물(만난올리고당의 원료), 건조 석류(0.5%), 건조 사과, 건조 시금치, 차전자피(0.3%), 건조 스위트 오렌지, 건조 블루베리, 소금, 건조 맥주효모, 강황(0.2%), 비타민 A, 비타민 D3, 비타민 E, 아스코르브산(수용성 비타민 C), 나이아신(수용성 비타민 B3), 판토텐산 칼슘(수용성 비타민 B5), 리보플라빈(수용성 비타민 B2), 피리독신 염산염(수용성 비타민 B6), 티아민(수용성 비타민 B1), 비오틴(수용성 비타민 H), 엽산(수용성 비타민 B9), 비타민 B12, 염화콜린, 베타카로틴, 아연 아미노산(메티오닌) 킬레이트, 망간 아미노산(메티오닌) 킬레이트, 철분 아미노산(글리신), 구리 아미노산(메티오닌) 킬레이트, DL- 메티오닌, 타우린(4000mg/kg 이상), 정제하고 가수분해한 닭연골(글루코사민 (1200mg/kg이상)과 콘드로이틴 황산(900mg/kg이상)의 원료), 알로에 베라겔, 녹차 추출물, 로즈마리 추출물, 혼합토코페롤(천연 항산화제) 비유전자변형"
448,고양이,지위픽 (ZIWI),에어드라이 닭고기 ,"키튼,어덜트,시니어,전연령",저온건조 사료,"닭고기, 닭 내장(간, 심장) 및 뼈, 뉴질랜드 녹색홍합, 레시틴, 치커리 이눌린, 건 켈프, 미네랄(제2인산칼륨, 황산마그네슘, 아연아미노산, 구리아미노산, 철아미노산, 망간아미노산, 아셀렌산나트륨), 천일염, 파슬리, 구연산, 혼합토코페롤, 비타민(염화콜린, 비타민 B1, 비타민 B6 염산염, 엽산, 비타민 D3), DL-메티오닌, 타우린",조단백 44%  조지방 36%  칼슘 1.81%  인 1.38%  수분 8.0%,"그레인프리,글루텐프리",20g,"5,500 kcal/kg","닭고기, 닭 내장(간, 심장) 및 뼈, 뉴질랜드 녹색홍합",뉴질랜드/Ziwi Ltd,https://cdn.purplesto.re/media/store/sale/main_image/ziwipeak_cat_B046CF15_thumb01%EC%83%98%ED%94%8C.png,"지위픽 (ZIWI) 에어드라이 닭고기  저온건조 사료 닭고기, 닭 내장(간, 심장) 및 뼈, 뉴질랜드 녹색홍합, 레시틴, 치커리 이눌린, 건 켈프, 미네랄(제2인산칼륨, 황산마그네슘, 아연아미노산, 구리아미노산, 철아미노산, 망간아미노산, 아셀렌산나트륨), 천일염, 파슬리, 구연산, 혼합토코페롤, 비타민(염화콜린, 비타민 B1, 비타민 B6 염산염, 엽산, 비타민 D3), DL-메티오닌, 타우린 그레인프리,글루텐프리"
449,고양이,미아모아 (MIAMOR),몰트 크림 ,"키튼,어덜트,시니어,전연령",습식간식,"밀크파우더, 정제수, 몰트(맥아), 타우린, 식물성녹말(찰옥수수추출)",조단백 4.5% 조지방 2.0% 조섬유 0.1% 조회분 0.7% 수분 96.0%,-,90g(15g x 6개입),390 kcal/kg,"밀크파우더, 정제수, 몰트(맥아)",독일/Finnern GmbH & Co. KG,https://cdn.purplesto.re/media/store/sale/main_image/miamor_cat_B104CT01_thumb01.png,"미아모아 (MIAMOR) 몰트 크림  습식간식 밀크파우더, 정제수, 몰트(맥아), 타우린, 식물성녹말(찰옥수수추출) -"
450,고양이,뉴로 (NULO),"뉴로 프리스타일 그레인프리 시니어 알래스카 명태, 오리&고구마","키튼,어덜트,시니어,전연령",건사료,"명태, 닭고기, 칠면조, 노란완두콩, 녹색렌틸콩, 오리, 닭고기지방, 연어, 건조고구마, 억새풀, 천연향, 아마씨, 건조켈프, 연어오일, 염화콜린, 건조치커리뿌리, 탄산칼슘, DL-메티오틴, 건조크랜베리, 비타민E, 유카시데게라추출물, L-카르니틴, 아연단백질, 니아신, 황산아연, 철단백질, L-아스코르빌-2-폴리포스페이트(비타민C 공급원), 산화망간, 비타민A, 티아민모노니트레이트, 판토센산칼슘, 구리단백질, 황산구리, 망간단백질, 리보플라빈, 피리독신염산염, 비오틴, 건조바실러스발효균, 비타민B12, 산화망간, 비타민D3, 타우린, 엽산, 소디움셀레나이트, 요오드산칼슘, 로즈마리추출물",조단백 38%  조지방 14%  칼슘 1.3%  인 0.9%  수분 10%,"그레인프리,글루텐프리,비유전자변형,유산균",5.4kg,"3,454 kcal/kg","명태, 닭고기, 칠면조",미국/Nulo Inc,https://cdn.purplesto.re/media/store/sale/main_image/nulo_cat_B137CF11_thumb02.png,"뉴로 (NULO) 뉴로 프리스타일 그레인프리 시니어 알래스카 명태, 오리&고구마 건사료 명태, 닭고기, 칠면조, 노란완두콩, 녹색렌틸콩, 오리, 닭고기지방, 연어, 건조고구마, 억새풀, 천연향, 아마씨, 건조켈프, 연어오일, 염화콜린, 건조치커리뿌리, 탄산칼슘, DL-메티오틴, 건조크랜베리, 비타민E, 유카시데게라추출물, L-카르니틴, 아연단백질, 니아신, 황산아연, 철단백질, L-아스코르빌-2-폴리포스페이트(비타민C 공급원), 산화망간, 비타민A, 티아민모노니트레이트, 판토센산칼슘, 구리단백질, 황산구리, 망간단백질, 리보플라빈, 피리독신염산염, 비오틴, 건조바실러스발효균, 비타민B12, 산화망간, 비타민D3, 타우린, 엽산, 소디움셀레나이트, 요오드산칼슘, 로즈마리추출물 그레인프리,글루텐프리,비유전자변형,유산균"
451,고양이,어플라우즈 (APPLAWS),토퍼 호박스프에 참치와 도미 ,"키튼,어덜트,시니어,전연령",토퍼(부스터),"정제수, 도미, 호박, 훈제 가다랑어(참치과) 흰살, 카라기닌",조단백 3.5% 조지방 0.1% 조섬유 1.0.5% 조회분 1.0% 수분 95.0%,"그레인프리,글루텐프리",120g,150 kcal/kg (6 kcal/소분팩),"정제수, 도미, 호박",태국/MPM Products,https://cdn.purplesto.re/media/store/sale/main_image/deal_applaws_cat_B004CT1438ss_thumb01.png,"어플라우즈 (APPLAWS) 토퍼 호박스프에 참치와 도미  토퍼(부스터) 정제수, 도미, 호박, 훈제 가다랑어(참치과) 흰살, 카라기닌 그레인프리,글루텐프리"
452,고양이,지위픽 (ZIWI),에어드라이 소고기 ,"키튼,어덜트,시니어,전연령",저온건조 사료,"소고기, 소 내장(심장, 신장, 트라이프, 간, 폐) 및 뼈, 뉴질랜드 녹색홍합, 레시틴, 치커리 이눌린, 건 켈프, 미네랄(제2인산칼륨, 황산마그네슘, 아연아미노산, 구리아미노산, 철아미노산, 망간아미노산, 아셀렌산나트륨), 천일염, 파슬리, 구연산, 혼합토코페롤, 비타민(염화콜린, 비타민 B1, B6, D3, 엽산), DL-메티오닌, 타우린",조단백 44%  조지방 35%  칼슘 2.58%  인 1.73%  수분 8.0%,"그레인프리,글루텐프리",20g,"5,500 kcal/kg","소고기, 소 내장(심장, 신장, 트라이프, 간, 폐) 및 뼈, 뉴질랜드 녹색홍합",뉴질랜드/Ziwi Ltd,https://cdn.purplesto.re/media/store/sale/main_image/ziwipeak_cat_B046CF13_thumb01%EC%83%98%ED%94%8C.png,"지위픽 (ZIWI) 에어드라이 소고기  저온건조 사료 소고기, 소 내장(심장, 신장, 트라이프, 간, 폐) 및 뼈, 뉴질랜드 녹색홍합, 레시틴, 치커리 이눌린, 건 켈프, 미네랄(제2인산칼륨, 황산마그네슘, 아연아미노산, 구리아미노산, 철아미노산, 망간아미노산, 아셀렌산나트륨), 천일염, 파슬리, 구연산, 혼합토코페롤, 비타민(염화콜린, 비타민 B1, B6, D3, 엽산), DL-메티오닌, 타우린 그레인프리,글루텐프리"
453,고양이,알모네이쳐 (ALMO NATURE),HFC 내츄럴플러스 파우치 정어리 ,"키튼,어덜트,시니어,전연령",습식간식,"정어리살(91%), 정제수(7.5%), 쌀(1.5%)",조단백 18.7%  조지방 6.6%  조섬유 0.012%  조회분 3.1%  수분 85.5% ,"단일육류단백질,글루텐프리,비유전자변형",55g,877 kcal/kg (48 kcal/파우치),"정어리살, 정제수, 쌀",태국/Songkla Canning Public Co.Ltd,https://cdn.purplesto.re/media/store/sale/main_image/deal_almonature_cat_B131CT0402SS_thumb01.png,"알모네이쳐 (ALMO NATURE) HFC 내츄럴플러스 파우치 정어리  습식간식 정어리살(91%), 정제수(7.5%), 쌀(1.5%) 단일육류단백질,글루텐프리,비유전자변형"
454,고양이,보레알 (BOREAL),주식캔 치킨&오리 ,"어덜트,시니어",습식 사료,"치킨, 치킨육수, 오리, 치킨간, 완두콩, 강낭콩, 계란, 레시틴, 탄산칼슘, 아마씨, 콜린클로라이드, 일인산나트륨, 생선오일, 식물성오일, DL-메티오닌, 유카시데게라추출물, 완두콩섬유질, 블루베리, 블랙베리, 사과, 석류, 크랜베리, 타우린, L-아스코르빌-2-폴리포스페이트(비타민C의 공급원), 아연아미노산복합체, 비타민E, 황산제일철, 철아미노산복합체, 황산아연, 니아신, 티아민모노나이트레이트, 구리프로테인산염, 비타민A, 셀렌산나트륨, 황산망간, 망간아미노산복합체, D-칼슘판토테네이트, 피리독신염산염, 리보플라빈, 비오틴, 비타민D3, 비타민B12, 요오드산칼슘, 엽산.",조단백 7.2%  조지방 6.3%  칼슘 0.2%  인 0.18%  수분 85%,"검류미함유,그레인프리,글루텐프리",156g,"1,050 kcal/kg","치킨, 치킨육수, 오리",캐나다/Boreal Pet Foods.,https://cdn.purplesto.re/media/store/sale/main_image/deal_boreal_cat_B050CF0904SS_thumb01.png,"보레알 (BOREAL) 주식캔 치킨&오리  습식 사료 치킨, 치킨육수, 오리, 치킨간, 완두콩, 강낭콩, 계란, 레시틴, 탄산칼슘, 아마씨, 콜린클로라이드, 일인산나트륨, 생선오일, 식물성오일, DL-메티오닌, 유카시데게라추출물, 완두콩섬유질, 블루베리, 블랙베리, 사과, 석류, 크랜베리, 타우린, L-아스코르빌-2-폴리포스페이트(비타민C의 공급원), 아연아미노산복합체, 비타민E, 황산제일철, 철아미노산복합체, 황산아연, 니아신, 티아민모노나이트레이트, 구리프로테인산염, 비타민A, 셀렌산나트륨, 황산망간, 망간아미노산복합체, D-칼슘판토테네이트, 피리독신염산염, 리보플라빈, 비오틴, 비타민D3, 비타민B12, 요오드산칼슘, 엽산. 검류미함유,그레인프리,글루텐프리"
455,고양이,고! (GO!),데일리디펜스 치킨,"어덜트,시니어",건사료,"닭고기, 통현미, 오트밀, 연어, 천연맛, 해바라기씨오일, 왕겨, 사과, 당근, 감자, 타우린, 비타민합제(비타민A, D3, E, C 등), 미량광물질류합제(아연, 철, 구리 등), L-리진",조단백 30.0%  조지방 20.0%  칼슘 1.2%  인 0.8%  수분 10.0%,-,3.6kg,"4,604 kcal/kg","닭고기, 통현미, 오트밀",캐나다/Petcurean Pet Nutrition Inc.,https://cdn.purplesto.re/media/store/sale/main_image/go_cat_B010CF01_thumb01.png,"고! (GO!) 데일리디펜스 치킨 건사료 닭고기, 통현미, 오트밀, 연어, 천연맛, 해바라기씨오일, 왕겨, 사과, 당근, 감자, 타우린, 비타민합제(비타민A, D3, E, C 등), 미량광물질류합제(아연, 철, 구리 등), L-리진 -"
456,고양이,지위픽 (ZIWI),에어드라이 이스트 케이프,"키튼,어덜트,시니어,전연령",저온건조 사료,"양고기, 염소고기, 호주연어, 전갱이, 고등어, 도축부산물[염소 위장,양 폐/위장, 염소 간, 양 간/뼈, 염소 심장/폐/신장/뼈], 녹색홍합, 레시틴, 치커리 이눌린, 켈프, 사과박, 미네랄[제이인산칼륨, 황산마그네슘, 아연아미노산화합물, 철분아미노산화합물, 구리아미노산화합물, 망간아미노산화합물, 아셀렌산나트륨], 비타민합제[염화콜린, 비타민B1, 비타민B6, 비타민D3, 엽산], 보존제[구연산,혼합 토코페롤], 정제염, DL-메티오닌, 타우린",조단백 42%  조지방 36%  칼슘 1.74%  인 1.4%  수분 9%,"그레인프리,글루텐프리","340g, 128g","5,015 kcal/kg","양고기, 염소고기, 호주연어","뉴질랜드/ZIWI2, ZIWI Limited",https://cdn.purplesto.re/media/store/sale/main_image/ziwipeak_cat_B046CF32_thumb01.png,"지위픽 (ZIWI) 에어드라이 이스트 케이프 저온건조 사료 양고기, 염소고기, 호주연어, 전갱이, 고등어, 도축부산물[염소 위장,양 폐/위장, 염소 간, 양 간/뼈, 염소 심장/폐/신장/뼈], 녹색홍합, 레시틴, 치커리 이눌린, 켈프, 사과박, 미네랄[제이인산칼륨, 황산마그네슘, 아연아미노산화합물, 철분아미노산화합물, 구리아미노산화합물, 망간아미노산화합물, 아셀렌산나트륨], 비타민합제[염화콜린, 비타민B1, 비타민B6, 비타민D3, 엽산], 보존제[구연산,혼합 토코페롤], 정제염, DL-메티오닌, 타우린 그레인프리,글루텐프리"
457,고양이,알모네이쳐 (ALMO NATURE),HFC 미니푸드 닭고기살 ,"키튼,어덜트,시니어,전연령",습식간식,"닭고기살(99%), 쌀(1%)",조단백 33.0%  조지방 0.5%  조섬유 0.5%  조회분 2.0%  수분 65.0% ,"단일육류단백질,글루텐프리,비유전자변형",3g,"1,200 kcal/kg (3.6 kcal/개)","닭고기살, 쌀",태국/Songkla Canning Public Co.Ltd,https://cdn.purplesto.re/media/store/sale/main_image/deal_almonature_cat_B131CT1502SS_thumb01.png,"알모네이쳐 (ALMO NATURE) HFC 미니푸드 닭고기살  습식간식 닭고기살(99%), 쌀(1%) 단일육류단백질,글루텐프리,비유전자변형"
458,고양이,나우 (NOW),그레인프리 키튼,"키튼,어덜트,시니어,전연령",건사료,"뼈를 발라낸 칠면조, 감자분말, 완두콩, 감자, 건조계란, 카놀라오일, 완두콩섬유, 토마토, 천연향, 아마씨, 코코넛오일, 뼈를 발라낸 연어, 뼈를 발라낸 오리, 당근, 호박, 사과, 바나나, 블루베리, 크랜베리, 블랙베리, 파파야, 파인애플, 자몽, 렌틸콩, 브로콜리, 시금치, 코티지치즈, 알팔파 싹, 제이인산 칼슘, 자연건조 알팔파, 건조 켈프, 탄산칼슘, 인산, 염화나트륨, 레시틴, 염화칼슘, DL-메티오닌, 타우린, 건조 해초분말, 비타민합제(비타민E, L-아스코빌~ 2-폴리인산, 나이아신, 비타민A, 티아민 모노니트레이트, d-판토텐산칼슘, 염산피리독신, 리보플라빈, 베타카로틴, 비타민D3, 엽산, 비오틴, 비타민B12), 미량광물질류합제아연단백질화합물 황산제일철, 산화아연, 철단백질화합물, 황산동, 구리단백질화합물, 망간단백질화합물, 산화망간, 요오드산칼슘, 아셀 렌산나트륨), L-라이신, 건조 치커리 뿌리, 건조 락토바실러시 애시도필러스, 건조 엔테로코커스 패시움, 건조 아스퍼질러스 니게로 건조 아스퍼질러스 오리제, 효모추출물, 유카 추출물, L-카르니틴, 마리골드, 건조 로즈마리",조단백 33%  조지방 20%  칼슘 1%  인 0.8%  수분 8%,"그레인프리,글루텐프리",3.6kg,"3,947 kcal/kg","뼈를 발라낸 칠면조, 감자분말, 완두콩",캐나다/Petcurean Pet Nutrition Inc.,https://cdn.purplesto.re/media/store/sale/main_image/now_cat_B012CF01_thumb01.png,"나우 (NOW) 그레인프리 키튼 건사료 뼈를 발라낸 칠면조, 감자분말, 완두콩, 감자, 건조계란, 카놀라오일, 완두콩섬유, 토마토, 천연향, 아마씨, 코코넛오일, 뼈를 발라낸 연어, 뼈를 발라낸 오리, 당근, 호박, 사과, 바나나, 블루베리, 크랜베리, 블랙베리, 파파야, 파인애플, 자몽, 렌틸콩, 브로콜리, 시금치, 코티지치즈, 알팔파 싹, 제이인산 칼슘, 자연건조 알팔파, 건조 켈프, 탄산칼슘, 인산, 염화나트륨, 레시틴, 염화칼슘, DL-메티오닌, 타우린, 건조 해초분말, 비타민합제(비타민E, L-아스코빌~ 2-폴리인산, 나이아신, 비타민A, 티아민 모노니트레이트, d-판토텐산칼슘, 염산피리독신, 리보플라빈, 베타카로틴, 비타민D3, 엽산, 비오틴, 비타민B12), 미량광물질류합제아연단백질화합물 황산제일철, 산화아연, 철단백질화합물, 황산동, 구리단백질화합물, 망간단백질화합물, 산화망간, 요오드산칼슘, 아셀 렌산나트륨), L-라이신, 건조 치커리 뿌리, 건조 락토바실러시 애시도필러스, 건조 엔테로코커스 패시움, 건조 아스퍼질러스 니게로 건조 아스퍼질러스 오리제, 효모추출물, 유카 추출물, L-카르니틴, 마리골드, 건조 로즈마리 그레인프리,글루텐프리"
459,고양이,헤일로 (HALO),어덜트 그레인프리 연어 스튜,"키튼,어덜트,시니어,전연령",습식사료,"연어, 정제수, 닭간, 칠면조, 당근, 완두콩, 셀러리, 풋강낭콩, 고구마, 겨잣잎, 오크라, 구아검, 제삼인산칼슘, 염화칼륨, 호박, 아마씨유, 잔탄검, 미량광물질합제(철-아미노산킬레이트, 아연-아미노산킬레이트 등), 염화콜린, 비타민제합제(비타민E, 비타민B1질산염 등), 타우린, 건조켈프, 천연착향료, 연어오일",조단백 10.1%  조지방 8.0%  칼슘 0.3%  인 0.3%  수분 79.4%,"그레인프리,글루텐프리,비유전자변형",156g,"1,047 kcal/kg (163 kcal/캔)","연어, 정제수, 닭간",미국/Halo pet,https://cdn.purplesto.re/media/store/sale/main_image/halo_cat_B044CF12_thumb01.png,"헤일로 (HALO) 어덜트 그레인프리 연어 스튜 습식사료 연어, 정제수, 닭간, 칠면조, 당근, 완두콩, 셀러리, 풋강낭콩, 고구마, 겨잣잎, 오크라, 구아검, 제삼인산칼슘, 염화칼륨, 호박, 아마씨유, 잔탄검, 미량광물질합제(철-아미노산킬레이트, 아연-아미노산킬레이트 등), 염화콜린, 비타민제합제(비타민E, 비타민B1질산염 등), 타우린, 건조켈프, 천연착향료, 연어오일 그레인프리,글루텐프리,비유전자변형"
460,고양이,지위픽 (ZIWI),에어드라이 고등어&양고기,"키튼,어덜트,시니어,전연령",저온건조 사료,"생선(고등어), 양고기, 양 내장(위, 심장, 신장, 폐), 뉴질랜드 녹색홍합, 양 뼈, 치커리 이눌린, 건 켈프, 천일염, 파슬리, 미네랄(마그네슘 아미노산, 아연 아미노산, 구리 아미노산, 셀레늄효모, 망간 아미노산), 타우린, 비타민(비타민 B1, 엽산, 비타민 D3), 천연 혼합 토코페롤",조단백 47%  조지방 30%  칼슘 1.82%  인 1.54%  수분 8.0%,"그레인프리,글루텐프리",400g,"4,800 kcal/kg","생선(고등어), 양고기, 양 내장(위, 심장, 신장, 폐)",뉴질랜드/Ziwi Ltd,https://cdn.purplesto.re/media/store/sale/main_image/ziwipeak_cat_B046CF17_thumb01.png,"지위픽 (ZIWI) 에어드라이 고등어&양고기 저온건조 사료 생선(고등어), 양고기, 양 내장(위, 심장, 신장, 폐), 뉴질랜드 녹색홍합, 양 뼈, 치커리 이눌린, 건 켈프, 천일염, 파슬리, 미네랄(마그네슘 아미노산, 아연 아미노산, 구리 아미노산, 셀레늄효모, 망간 아미노산), 타우린, 비타민(비타민 B1, 엽산, 비타민 D3), 천연 혼합 토코페롤 그레인프리,글루텐프리"
461,고양이,지위픽 (ZIWI),주식캔 고등어&양고기,"키튼,어덜트,시니어,전연령",습식사료,"고등어, 수분, 양고기, 양 내장(폐, 트라이프, 심장, 신장, 간) 및 뼈, 병아리콩, 뉴질랜드 녹색홍합, DL-메티오닌, 건 켈프, 미네랄(황산마그네슘, 아연아미노산, 망간아미노산, 구리아미노산), 비타민(비타민 E, 비타민 B1, 비타민 B3, 비타민 B6, 비타민 B2, 비타민 D3, 엽산), 타우린",조단백 14%  조지방 6%  칼슘 0.44%  인 0.35%  수분 75.5%,"검류미함유,그레인프리,글루텐프리","85g, 185g","1,200 kcal/kg","고등어, 수분, 양고기",뉴질랜드/Ziwi Ltd,https://cdn.purplesto.re/media/store/sale/main_image/ziwipeak_cat_B046CF24_thumb01.png,"지위픽 (ZIWI) 주식캔 고등어&양고기 습식사료 고등어, 수분, 양고기, 양 내장(폐, 트라이프, 심장, 신장, 간) 및 뼈, 병아리콩, 뉴질랜드 녹색홍합, DL-메티오닌, 건 켈프, 미네랄(황산마그네슘, 아연아미노산, 망간아미노산, 구리아미노산), 비타민(비타민 E, 비타민 B1, 비타민 B3, 비타민 B6, 비타민 B2, 비타민 D3, 엽산), 타우린 검류미함유,그레인프리,글루텐프리"
462,고양이,그랜마메이스 (GRANDMAMAES),그레인프리 치킨,"키튼,어덜트,시니어,전연령",건사료,"닭고기분말, 완두콩, 렌틸콩, 병아리콩, 청어분, 계란, 태평양청어오일, DL_메틸오닌, 킬레이트탄산칼슘, 레시틴, 킬레이트염화콜린, L-레진, 타우린, 유카시디게라추출물, 비타민E, 니아신첨가물, 유기농건다시마, 질산염, 리보프라빈, 아스코르브산, 비오틴, 판토텐산, D-칼슘, 비타민B12, 비타민A, 비타민D3, 구연산, 엽산, 킬레이트염화나트륨, 철황산염, 아연황산염, 킬레이트아연, 황산구리, 산화아연, 황산망간, 킬레이트망간, 킬레이트구리, 산화망간, 셀레늄, 킬레이트요오드산칼슘",조단백 35%  조지방 17%  칼슘 1.04%  인 0.8%  수분 10%,"그레인프리,글루텐프리,비유전자변형","5.4kg, 2.7kg","3,700 kcal/kg","닭고기분말, 완두콩, 렌틸콩",미국/SOUTHERN TIER PET NUTRTION. USA,https://cdn.purplesto.re/media/store/sale/main_image/grandmamaes_cat_B120CF01_thumb01.png,"그랜마메이스 (GRANDMAMAES) 그레인프리 치킨 건사료 닭고기분말, 완두콩, 렌틸콩, 병아리콩, 청어분, 계란, 태평양청어오일, DL_메틸오닌, 킬레이트탄산칼슘, 레시틴, 킬레이트염화콜린, L-레진, 타우린, 유카시디게라추출물, 비타민E, 니아신첨가물, 유기농건다시마, 질산염, 리보프라빈, 아스코르브산, 비오틴, 판토텐산, D-칼슘, 비타민B12, 비타민A, 비타민D3, 구연산, 엽산, 킬레이트염화나트륨, 철황산염, 아연황산염, 킬레이트아연, 황산구리, 산화아연, 황산망간, 킬레이트망간, 킬레이트구리, 산화망간, 셀레늄, 킬레이트요오드산칼슘 그레인프리,글루텐프리,비유전자변형"
463,고양이,어플라우즈 (APPLAWS),통살 참치 ,"키튼,어덜트,시니어,전연령",습식간식,가다랑어(참치),조단백 23.0% 조지방 2.0% 조회분 3.0% 수분 75.0%,검류미함유,30g,"1,330 kcal/kg (39.9 kcal/파우치)",가다랑어(참치),태국/MPM Products,https://cdn.purplesto.re/media/store/sale/main_image/deal_applaws_cat_B004CT1034ss_thumb01.png,어플라우즈 (APPLAWS) 통살 참치  습식간식 가다랑어(참치) 검류미함유
