uuid,category,brand,title,age,classification,content,nutrient,info,gram,calory,ingredient,detail,from_company,성분등록번호,img
460,고양이,지위픽 (ZIWI),에어드라이 고등어&양고기,"키튼,어덜트,시니어,전연령",저온건조 사료,"생선(고등어), 양고기, 양 내장(위, 심장, 신장, 폐), 뉴질랜드 녹색홍합, 양 뼈, 치커리 이눌린, 건 켈프, 천일염, 파슬리, 미네랄(마그네슘 아미노산, 아연 아미노산, 구리 아미노산, 셀레늄효모, 망간 아미노산), 타우린, 비타민(비타민 B1, 엽산, 비타민 D3), 천연 혼합 토코페롤",조단백 47%  조지방 30%  칼슘 1.82%  인 1.54%  수분 8.0%,"그레인프리,글루텐프리",400g,"4,800 kcal/kg","생선(고등어), 양고기, 양 내장(위, 심장, 신장, 폐)","연령구분 키튼,어덜트,시니어,전연령 푸드타입 저온건조 사료 중량 400g 주재료 생선(고등어), 양고기, 양 내장(위, 심장, 신장, 폐) 식단정보 그레인프리,글루텐프리 칼로리 4,800 kcal/kg 원산지/제조사 뉴질랜드/Ziwi Ltd",뉴질랜드/Ziwi Ltd,제 서울-15608호,https://cdn.purplesto.re/media/store/sale/main_image/ziwipeak_cat_B046CF17_thumb01.png
461,고양이,지위픽 (ZIWI),주식캔 고등어&양고기,"키튼,어덜트,시니어,전연령",습식사료,"고등어, 수분, 양고기, 양 내장(폐, 트라이프, 심장, 신장, 간) 및 뼈, 병아리콩, 뉴질랜드 녹색홍합, DL-메티오닌, 건 켈프, 미네랄(황산마그네슘, 아연아미노산, 망간아미노산, 구리아미노산), 비타민(비타민 E, 비타민 B1, 비타민 B3, 비타민 B6, 비타민 B2, 비타민 D3, 엽산), 타우린",조단백 14%  조지방 6%  칼슘 0.44%  인 0.35%  수분 75.5%,"검류미함유,그레인프리,글루텐프리","85g, 185g","1,200 kcal/kg","고등어, 수분, 양고기","연령구분 키튼,어덜트,시니어,전연령 푸드타입 습식사료 중량 85g, 185g 주재료 고등어, 수분, 양고기 식단정보 검류미함유,그레인프리,글루텐프리 칼로리 1,200 kcal/kg 원산지/제조사 뉴질랜드/Ziwi Ltd",뉴질랜드/Ziwi Ltd,제 Ⅱ 60G0489호,https://cdn.purplesto.re/media/store/sale/main_image/ziwipeak_cat_B046CF24_thumb01.png
462,고양이,그랜마메이스 (GRANDMAMAES),그레인프리 치킨,"키튼,어덜트,시니어,전연령",건사료,"닭고기분말, 완두콩, 렌틸콩, 병아리콩, 청어분, 계란, 태평양청어오일, DL_메틸오닌, 킬레이트탄산칼슘, 레시틴, 킬레이트염화콜린, L-레진, 타우린, 유카시디게라추출물, 비타민E, 니아신첨가물, 유기농건다시마, 질산염, 리보프라빈, 아스코르브산, 비오틴, 판토텐산, D-칼슘, 비타민B12, 비타민A, 비타민D3, 구연산, 엽산, 킬레이트염화나트륨, 철황산염, 아연황산염, 킬레이트아연, 황산구리, 산화아연, 황산망간, 킬레이트망간, 킬레이트구리, 산화망간, 셀레늄, 킬레이트요오드산칼슘",조단백 35%  조지방 17%  칼슘 1.04%  인 0.8%  수분 10%,"그레인프리,글루텐프리,비유전자변형","5.4kg, 2.7kg","3,700 kcal/kg","닭고기분말, 완두콩, 렌틸콩","연령구분 키튼,어덜트,시니어,전연령 푸드타입 건사료 중량 5.4kg, 2.7kg 주재료 닭고기분말, 완두콩, 렌틸콩 식단정보 그레인프리,글루텐프리,비유전자변형 칼로리 3,700 kcal/kg 원산지/제조사 미국/SOUTHERN TIER PET NUTRTION. USA",미국/SOUTHERN TIER PET NUTRTION. USA,EEGSB0043호,https://cdn.purplesto.re/media/store/sale/main_image/grandmamaes_cat_B120CF01_thumb01.png
463,고양이,어플라우즈 (APPLAWS),통살 참치 ,"키튼,어덜트,시니어,전연령",습식간식,가다랑어(참치),조단백 23.0% 조지방 2.0% 조회분 3.0% 수분 75.0%,검류미함유,30g,"1,330 kcal/kg (39.9 kcal/파우치)",가다랑어(참치),"연령구분 키튼,어덜트,시니어,전연령 푸드타입 습식간식 중량 30g 주재료 가다랑어(참치) 식단정보 검류미함유 칼로리 1,330 kcal/kg (39.9 kcal/파우치) 원산지/제조사 태국/MPM Products",태국/MPM Products,제 서울-22062호,https://cdn.purplesto.re/media/store/sale/main_image/deal_applaws_cat_B004CT1034ss_thumb01.png
464,고양이,아딜론덱 (ADIRONDACK),그레인프리 LID 인도어캣 닭고기,"어덜트,시니어",건사료,"닭고기, 닭고기분말, 완두콩, 렌틸콩, 파바콩, 타피오카, 흰살생선, 병아리콩, 닭 지방, 아마씨, 천연향료, 완두콩단백질, 알팔파, 청어기름, DL-메티오닌, 제1인산염, 크랜베리, 블루베리, 타우린, 프락토올리고당, 아스크로빈산, 비타민D3, 유카추출물, 탄산칼슘, 왕겨, 야채오일, 로즈마리, 다시마, 비타민E, 비타민제합제(비타민B12, 비타민A, 엽산), 혼합광물질류합제(비피더스균, 구연산, 유산균)",조단백 32%  조지방 12%  칼슘 0.6%  인 0.5%  수분 10%,"단일육류단백질,그레인프리,글루텐프리",5kg,"3,436 kcal/kg","닭고기, 닭고기분말, 완두콩","연령구분 어덜트,시니어 푸드타입 건사료 중량 5kg 주재료 닭고기, 닭고기분말, 완두콩 식단정보 단일육류단백질,그레인프리,글루텐프리 칼로리 3,436 kcal/kg 원산지/제조사 미국/Blackwood Pet Foods, Inc","미국/Blackwood Pet Foods, Inc",제 서울-19744호,https://cdn.purplesto.re/media/store/sale/main_image/adirondack_cat_B027CF01_thumb01.png
465,고양이,지위픽 (ZIWI),주식캔 닭고기 ,"키튼,어덜트,시니어,전연령",습식사료,"닭고기, 수분, 닭 내장(간,심장) 및 뼈, 병아리콩, 뉴질랜드 녹색홍합, DL-메티오닌, 미네랄(황산마그네슘, 아연아미노산, 망간아미노산, 구리아미노산), 건 켈프, 비타민(염화콜린, 비타민 E, 비타민 B1, 비타민 B3, 비타민 B6 염산염, 비타민 B2, 비타민 D3, 엽산), 천일염, 타우린",조단백 12%  조지방 8%  칼슘 0.44%  인 0.38%  수분 74%,"검류미함유,그레인프리,글루텐프리",185g,"1,325 kcal/kg","닭고기, 수분, 닭 내장(간, 심장) 및 뼈","연령구분 키튼,어덜트,시니어,전연령 푸드타입 습식사료 중량 185g 주재료 닭고기, 수분, 닭 내장(간, 심장) 및 뼈 식단정보 검류미함유,그레인프리,글루텐프리 칼로리 1,325 kcal/kg 원산지/제조사 뉴질랜드/Ziwi Ltd",뉴질랜드/Ziwi Ltd,제 서울-15608호,https://cdn.purplesto.re/media/store/sale/main_image/deal_ziwipeak_cat_B046CF2004SS_thumb01.png
466,고양이,고! (GO!),그레인프리 LID 오리,"어덜트,시니어",건사료,"오리, 완두콩, 타피오카, 렌즈콩, 병아리콩, 타우린, 비타민합제(비타민A, D3, E, C 등), 미량광물질류합제(아연, 철, 구리 등)",조단백 31.0%  조지방 15.0%  칼슘 1.0%  인 0.8%  수분 10.0%,"단일육류단백질,그레인프리,글루텐프리",1.8kg,"4,222 kcal/kg","오리, 완두콩, 타피오카","연령구분 어덜트,시니어 푸드타입 건사료 중량 1.8kg 주재료 오리, 완두콩, 타피오카 식단정보 단일육류단백질,그레인프리,글루텐프리 칼로리 4,222 kcal/kg 원산지/제조사 캐나다/Petcurean Pet Nutrition Inc.",캐나다/Petcurean Pet Nutrition Inc.,제 서울-19594호,https://cdn.purplesto.re/media/store/sale/main_image/go_cat_B010CF03_thumb01.png
467,고양이,지위픽 (ZIWI),에어드라이 오타고 밸리,"키튼,어덜트,시니어,전연령",저온건조 사료,"소고기, 사슴고기, 양고기, 대구, 남방대구, 도축부산물[소 신장, 양 위장, 소 심장, 사슴 폐, 사슴 위장, 양 폐, 양 간, 소 간, 양 신장, 소 신장, 양 뼈, 소 뼈, 사슴 뼈], 녹색홍합, 레시틴, 이눌린, 켈프, 사과박, 미네랄[제이인산칼륨, 황산마그네슘, 아연아미노산화합물, 철분아미노산화합물, 구리아미노산화합물, 망간아미노산화합물, 아셀렌산나트륨]), 비타민합제[비타민B1, 비타민B6, 엽산, 비타민D3], 보존제[구연산, 혼합 토코페롤]), 정제염, DL-메티오닌, 타우린",조단백 40%  조지방 37%  칼슘 1.79%  인 1.4%  수분 9%,"그레인프리,글루텐프리",340g,"5,070 kcal/kg","소고기, 사슴고기, 양고기","연령구분 키튼,어덜트,시니어,전연령 푸드타입 저온건조 사료 중량 340g 주재료 소고기, 사슴고기, 양고기 식단정보 그레인프리,글루텐프리 칼로리 5,070 kcal/kg 원산지/제조사 뉴질랜드/ZIWI2, ZIWI Limited","뉴질랜드/ZIWI2, ZIWI Limited",EEGSB0043호,https://cdn.purplesto.re/media/store/sale/main_image/ziwipeak_cat_B046CF33_thumb01.png
468,고양이,카루 (CARU),클래식 치킨&크랩 스튜,"어덜트,시니어",습식사료,"닭고기, 닭고기육수, 게, 타피오카전분, 난백, 고구마, 당근, 사과, 천연향, 제삼인산칼슘, 염화콜린, 타우린, 탄산칼슘, 민들레잎사귀, 염화칼륨, 비타민[비타민A보충제, 비타민D3보충제, 비타민E 보충제, 비타민B1 질산염, 나이아신보충제(비타민B), 피리독신염산염(비타민B6), 판토텐산칼슘(비타민B5), 리보플라빈보충제(비타민B2), 엽산, 비오틴(비타민B7), 비타민B12보충제, 미네랄(아연아미노산, 철아미노산, 구리아미노산, 망간아미노산, 마그네슘아미노산, 요오드아미노산, 아셀렌산나트륨)",조단백 10%  조지방 3%  칼슘 0.2%  인 0.15%  수분 82%,"검류미함유,그레인프리,글루텐프리,비유전자변형",170g,888 kcal/kg (150 kcal/팩),"닭고기, 닭고기 육수, 게","연령구분 어덜트,시니어 푸드타입 습식사료 중량 170g 주재료 닭고기, 닭고기 육수, 게 식단정보 검류미함유,그레인프리,글루텐프리,비유전자변형 칼로리 888 kcal/kg (150 kcal/팩) 원산지/제조사 미국/Caru Pet Food",미국/Caru Pet Food,제 서울-19744호,https://cdn.purplesto.re/media/store/sale/main_image/caru_cat_B033CF02_thumb01.png
469,고양이,알모네이쳐 (ALMO NATURE),HFC 내츄럴플러스 파우치 닭다리살,"키튼,어덜트,시니어,전연령",습식간식,"닭다리살(91%), 정제수(7.5%), 쌀(1.5%)",조단백 19.3%  조지방 5.4%  조섬유 0.207%  조회분 1.9%  수분 83.6% ,"단일육류단백질,글루텐프리,비유전자변형",55g,"1,024 kcal/kg (56 kcal/파우치)","닭다리살, 정제수, 쌀","연령구분 키튼,어덜트,시니어,전연령 푸드타입 습식간식 중량 55g 주재료 닭다리살, 정제수, 쌀 식단정보 단일육류단백질,글루텐프리,비유전자변형 칼로리 1,024 kcal/kg (56 kcal/파우치) 원산지/제조사 태국/Songkla Canning Public Co.Ltd",태국/Songkla Canning Public Co.Ltd,서울-24147호,https://cdn.purplesto.re/media/store/sale/main_image/almonature_cat_B131CT03_thumb01.png
470,고양이,헤일로 (HALO),인도어캣 그레인프리 치킨&치킨 간,"어덜트,시니어",건사료,"닭, 닭간, 전란, 완두콩분말, 건조병아리콩, 콩단백질, 감자분말, 아마씨, 완두콩식이섬유, 천연액상향미제(가수분해 가금류간, d-토코페롤(혼합형)), 감자단백질, 계유, 연어오일, 황산칼슘, 천연고형향미제(가수분해 가금류간, d-토코페롤(혼합형)), 제이인산칼슘, 프로바이오틱(효모(사카로미세스세레비시아), 바실러스코아글란스), 건조블루베리, 건조크랜베리, 건조당근, 고구마분말, 소금, 이눌린, 비타민제합제(비타민A, 비타민D3, 비타민E, 비타민B12, 비오틴, 엽산, 니코틴산, 판토텐산, 피리독신, 리보플라빈, 티아민), 염화칼륨, 미량광물질류합제(아연, 철, 염화칼륨, 구리, 망간, 아셀렌산나트륨, 미네랄오일, 요오드산칼슘), 타우린, 비타민E, 천연산화방지제(d-토코페롤(혼합형), 로즈마리추출물), 비타민C, L-카르니틴",조단백 32.0%  조지방 16.0%  칼슘 0.6%  인 0.5%  수분 10.0%,"그레인프리,글루텐프리,비유전자변형",1.3kg,"3,610 kcal/kg","닭, 닭간, 전란","연령구분 어덜트,시니어 푸드타입 건사료 중량 1.3kg 주재료 닭, 닭간, 전란 식단정보 그레인프리,글루텐프리,비유전자변형 칼로리 3,610 kcal/kg 원산지/제조사 미국/Halo pet",미국/Halo pet,4160000-034-2019-0001,https://cdn.purplesto.re/media/store/sale/main_image/halo_cat_B044CF02_thumb01.png
471,고양이,알모네이쳐 (ALMO NATURE),HFC 내츄럴플러스 파우치 닭가슴살 ,"키튼,어덜트,시니어,전연령",습식간식,"닭가슴살(98.5%), 쌀(1.5%)",조단백 25.4%  조지방 1.1%  조섬유 0.012%  조회분 2.9%  수분 77.6% ,"단일육류단백질,글루텐프리,비유전자변형",55g,928 kcal/kg (51 kcal/파우치),"닭가슴살, 쌀","연령구분 키튼,어덜트,시니어,전연령 푸드타입 습식간식 중량 55g 주재료 닭가슴살, 쌀 식단정보 단일육류단백질,글루텐프리,비유전자변형 칼로리 928 kcal/kg (51 kcal/파우치) 원산지/제조사 태국/Songkla Canning Public Co.Ltd",태국/Songkla Canning Public Co.Ltd,서울-24143호,https://cdn.purplesto.re/media/store/sale/main_image/deal_almonature_cat_B131CT0102SS_thumb01.png
472,고양이,로우즈 사시 (RAWZ SASHI),참치&정어리 ,"키튼,어덜트,시니어,전연령",습식간식,"참치, 생선 육수, 정어리, 타피오카 전분",조단백 11%  조지방 0.45%  조섬유 0.5%  조회분 1.6%  수분 87% ,"그레인프리,글루텐프리,음수량충전",50g,480 kcal/kg (24 kcal/파우치),"참치, 생선 육수, 정어리","연령구분 키튼,어덜트,시니어,전연령 푸드타입 습식간식 중량 50g 주재료 참치, 생선 육수, 정어리 식단정보 그레인프리,글루텐프리,음수량충전 칼로리 480 kcal/kg (24 kcal/파우치) 원산지/제조사 태국/Rawz Natural Pet Food",태국/Rawz Natural Pet Food,제 VVHDR0032호,https://cdn.purplesto.re/media/store/sale/main_image/deal_rawssashi_cat_B133CT0402SS_thumb01.png
473,고양이,알모네이쳐 (ALMO NATURE),HFC 미니푸드 연어살 ,"키튼,어덜트,시니어,전연령",습식간식,"연어살(99%), 쌀(1%)",조단백 26.0%  조지방 0.45%  조섬유 3.0%  조회분 4.0%  수분 70.0% ,"단일육류단백질,글루텐프리,비유전자변형",3g,"1,300 kcal/kg (3.9 kcal/개)","연어살, 쌀","연령구분 키튼,어덜트,시니어,전연령 푸드타입 습식간식 중량 3g 주재료 연어살, 쌀 식단정보 단일육류단백질,글루텐프리,비유전자변형 칼로리 1,300 kcal/kg (3.9 kcal/개) 원산지/제조사 태국/Songkla Canning Public Co.Ltd",태국/Songkla Canning Public Co.Ltd,서울-19784호,https://cdn.purplesto.re/media/store/sale/main_image/deal_almonature_cat_B131CT1602SS_thumb01.png
474,고양이,닥터링크 (DR.LINK),주식캔 no.38 퓨어센서티브 닭고기&메추리,"어덜트,시니어",습식사료,"닭고기(살코기, 심장, 간, 위, 목), 육수(가금류), 메추리, 미네랄(아연, 망간, 일수화물), MOS(만난올리고당), FOS(프락토올리고당), 연어 오일, 해바라기 오일, 보리지 오일, 차전자피, 타피오카 4%(최대)  * 1kg당 영양보충제 함량: 비타민 D3 200IU, 비타민 E(모두 rac-알파-토코페릴 아세테이트) 30 IU, 비오틴(D-(+)-비오틴): 300mcg, 아연(황산아연, 일수화물) 15mg, 망간(망간-(II)-황산염, 일수화물) 3mg, 요오드(요오드산 칼슘, 무수) 0.75mg, DL-메티오닌 20mg, 타우린 1,500mg",조단백 11%  조지방 6.1%  칼슘 0.19%  인 0.13%  수분 79%,"그레인프리,글루텐프리",200g,"1,003 kcal/kg (200.6 kcal/캔)","닭고기, 육수(가금류), 메추리, 미네랄(아연, 망간, 일수화물)","연령구분 어덜트,시니어 푸드타입 습식사료 중량 200g 주재료 닭고기, 육수(가금류), 메추리, 미네랄(아연, 망간, 일수화물) 식단정보 그레인프리,글루텐프리 칼로리 1,003 kcal/kg (200.6 kcal/캔) 원산지/제조사 독일/Landguth Heimtiernahrung GmbH",독일/Landguth Heimtiernahrung GmbH,제 EE12G0001호,https://cdn.purplesto.re/media/store/sale/main_image/drlink_cat_B107CF09_thumb01.png
475,고양이,퓨어비타 (PUREVITA), 그레인프리 연어,"키튼,어덜트,시니어,전연령",건사료,"연어, 연어분, 완두콩 전분, 해바라기유, 완두콩, 천연 연어향, 효모제(맥주 효모), 식염류, 근괴류(당근), 아미노산제(DL-메치오닌), 미량광물질류합제(철, 아연, 구리, 망간, 코발트, 셀레늄), 핵과류(체리, 살구), 장과류(크랜베리, 블루베리), 근채류(치커리), 비타민합제(A, D3, E, 니아신, 판토텐산칼슘, 티아민, 리보플라빈, 엽산, 비오틴, B12, C, 콜린, 이노시톨), 생균제(락토 바실러스 애시도필러스, 바실러스서브틸리스), 유익곰팡이균(아스퍼질러스오리제)",조단백 31%  조지방 18%  칼슘 1.1%  인 1.1%  수분 10%,"단일육류단백질,그레인프리,글루텐프리",141g,"4,084 kcal/kg","연어, 연어분, 완두콩 전분","연령구분 키튼,어덜트,시니어,전연령 푸드타입 건사료 중량 141g 주재료 연어, 연어분, 완두콩 전분 식단정보 단일육류단백질,그레인프리,글루텐프리 칼로리 4,084 kcal/kg 원산지/제조사 미국/Tuffy's Pet Food, Inc.","미국/Tuffy's Pet Food, Inc.",4160000-034-2019-0001,https://cdn.purplesto.re/media/store/sale/main_image/purevita_cat_B041CF02_thumb02_FGjJ28g.png
476,고양이,지위픽 (ZIWI),주식캔 사슴고기,"키튼,어덜트,시니어,전연령",습식사료,"사슴고기, 수분, 사슴 내장(간, 폐, 심장, 신장, 트라이프) 및 뼈, 병아리콩, 뉴질랜드 녹색홍합, DL-메티오닌, 건 켈프, 미네랄(황산마그네슘, 아연아미노산, 망간아미노산, 구리아미노산), 비타민(비타민 E, 비타민 B1, 비타민 B6 염산염, 비타민 D3, 엽산), 타우린",조단백 13%  조지방 6%  칼슘 0.48%  인 0.33%  수분 76%,"검류미함유,그레인프리,글루텐프리",185g,"1,200 kcal/kg","사슴고기, 수분, 사슴 내장(간, 폐, 심장, 신장, 트라이프) 및 뼈","연령구분 키튼,어덜트,시니어,전연령 푸드타입 습식사료 중량 185g 주재료 사슴고기, 수분, 사슴 내장(간, 폐, 심장, 신장, 트라이프) 및 뼈 식단정보 검류미함유,그레인프리,글루텐프리 칼로리 1,200 kcal/kg 원산지/제조사 뉴질랜드/Ziwi Ltd",뉴질랜드/Ziwi Ltd,제 서울-15608호,https://cdn.purplesto.re/media/store/sale/main_image/ziwipeak_cat_B046CF21_thumb01.png
477,고양이,고! (GO!),그레인프리 LID 오리,"어덜트,시니어",건사료,"오리, 완두콩, 타피오카, 렌즈콩, 병아리콩, 타우린, 비타민합제(비타민A, D3, E, C 등), 미량광물질류합제(아연, 철, 구리 등)",조단백 31.0%  조지방 15.0%  칼슘 1.0%  인 0.8%  수분 10.0%,"단일육류단백질,그레인프리,글루텐프리","1.8kg, 3.6kg, 100g, 7.2kg","4,222 kcal/kg","오리, 완두콩, 타피오카","연령구분 어덜트,시니어 푸드타입 건사료 중량 1.8kg, 3.6kg, 100g, 7.2kg 주재료 오리, 완두콩, 타피오카 식단정보 단일육류단백질,그레인프리,글루텐프리 칼로리 4,222 kcal/kg 원산지/제조사 캐나다/Petcurean Pet Nutrition Inc.",캐나다/Petcurean Pet Nutrition Inc.,제 서울-22065호,https://cdn.purplesto.re/media/store/sale/main_image/go_cat_B010CF03_thumb01.png
478,고양이,뉴로 (NULO),"프리스타일 그레인프리 시니어 알래스카 명태, 오리&고구마","키튼,어덜트,시니어,전연령",건사료,"명태, 닭고기, 칠면조, 노란완두콩, 녹색렌틸콩, 오리, 닭고기지방, 연어, 건조고구마, 억새풀, 천연향, 아마씨, 건조켈프, 연어오일, 염화콜린, 건조치커리뿌리, 탄산칼슘, DL-메티오틴, 건조크랜베리, 비타민E, 유카시데게라추출물, L-카르니틴, 아연단백질, 니아신, 황산아연, 철단백질, L-아스코르빌-2-폴리포스페이트(비타민C 공급원), 산화망간, 비타민A, 티아민모노니트레이트, 판토센산칼슘, 구리단백질, 황산구리, 망간단백질, 리보플라빈, 피리독신염산염, 비오틴, 건조바실러스발효균, 비타민B12, 산화망간, 비타민D3, 타우린, 엽산, 소디움셀레나이트, 요오드산칼슘, 로즈마리추출물",조단백 38%  조지방 14%  칼슘 1.3%  인 0.9%  수분 10%,"그레인프리,글루텐프리,비유전자변형,유산균","5.4kg, 2.2kg","3,454 kcal/kg","명태, 닭고기, 칠면조","연령구분 키튼,어덜트,시니어,전연령 푸드타입 건사료 중량 5.4kg, 2.2kg 주재료 명태, 닭고기, 칠면조 식단정보 그레인프리,글루텐프리,비유전자변형,유산균 칼로리 3,454 kcal/kg 원산지/제조사 미국/Nulo Inc",미국/Nulo Inc,,https://cdn.purplesto.re/media/store/sale/main_image/nulo_cat_B137CF11_thumb02.png
479,고양이,로우즈 사시 (RAWZ SASHI),연어&참치,"키튼,어덜트,시니어,전연령",습식간식,"연어, 생선 육수, 참치, 타피오카 전분",조단백 11%  조지방 0.45%  조섬유 0.5%  조회분 0.9%  수분 87% ,"그레인프리,글루텐프리,음수량충전",50g,480 kcal/kg (24 kcal/파우치),"연어, 생선 육수, 참치","연령구분 키튼,어덜트,시니어,전연령 푸드타입 습식간식 중량 50g 주재료 연어, 생선 육수, 참치 식단정보 그레인프리,글루텐프리,음수량충전 칼로리 480 kcal/kg (24 kcal/파우치) 원산지/제조사 태국/Rawz Natural Pet Food",태국/Rawz Natural Pet Food,제 VVHDR0029호,https://cdn.purplesto.re/media/store/sale/main_image/rawssashi_cat_B133CT05_thumb01.png
480,고양이,퓨어비타 (PUREVITA),그레인프리 연어,"키튼,어덜트,시니어,전연령",건사료,"연어, 연어분, 완두콩 전분, 해바라기유, 완두콩, 천연 연어향, 효모제(맥주 효모), 식염류, 근괴류(당근), 아미노산제(DL-메치오닌), 미량광물질류합제(철, 아연, 구리, 망간, 코발트, 셀레늄), 핵과류(체리, 살구), 장과류(크랜베리, 블루베리), 근채류(치커리), 비타민합제(A, D3, E, 니아신, 판토텐산칼슘, 티아민, 리보플라빈, 엽산, 비오틴, B12, C, 콜린, 이노시톨), 생균제(락토 바실러스 애시도필러스, 바실러스서브틸리스), 유익곰팡이균(아스퍼질러스오리제)",조단백 31%  조지방 18%  칼슘 1.1%  인 1.1%  수분 10%,"단일육류단백질,그레인프리,글루텐프리","6.8kg, 1kg, 3kg","4,084 kcal/kg","연어, 연어분, 완두콩 전분","연령구분 키튼,어덜트,시니어,전연령 푸드타입 건사료 중량 6.8kg, 1kg, 3kg 주재료 연어, 연어분, 완두콩 전분 식단정보 단일육류단백질,그레인프리,글루텐프리 칼로리 4,084 kcal/kg 원산지/제조사 미국/Tuffy's Pet Food, Inc.","미국/Tuffy's Pet Food, Inc.",,https://cdn.purplesto.re/media/store/sale/main_image/purevita_cat_B041CF02_thumb02.png
481,고양이,지위픽 (ZIWI),주식캔 닭고기,"키튼,어덜트,시니어,전연령",습식사료,"닭고기, 수분, 닭 내장(간,심장) 및 뼈, 병아리콩, 뉴질랜드 녹색홍합, DL-메티오닌, 미네랄(황산마그네슘, 아연아미노산, 망간아미노산, 구리아미노산), 건 켈프, 비타민(염화콜린, 비타민 E, 비타민 B1, 비타민 B3, 비타민 B6 염산염, 비타민 B2, 비타민 D3, 엽산), 천일염, 타우린",조단백 12%  조지방 8%  칼슘 0.44%  인 0.38%  수분 74%,"검류미함유,그레인프리,글루텐프리","85g, 185g","1,325 kcal/kg","닭고기, 수분, 닭 내장(간, 심장) 및 뼈","연령구분 키튼,어덜트,시니어,전연령 푸드타입 습식사료 중량 85g, 185g 주재료 닭고기, 수분, 닭 내장(간, 심장) 및 뼈 식단정보 검류미함유,그레인프리,글루텐프리 칼로리 1,325 kcal/kg 원산지/제조사 뉴질랜드/Ziwi Ltd",뉴질랜드/Ziwi Ltd,제 Ⅱ 60G0489호,https://cdn.purplesto.re/media/store/sale/main_image/ziwipeak_cat_B046CF20_thumb01.png
482,고양이,K9 내추럴 (K9 NATURAL),피스트 캔 소고기와 호키 ,"키튼,어덜트,시니어,전연령",습식사료,"소의 심장, 호키, 소고기, 소의 신장, 소의 간, 소의 혈액, 해바라기 오일, 아마씨, 뉴질랜드 녹색 입 홍합, 비타민E, 아연, 카놀라오일, 망간, 티아민, 비타민D3, 엽산, 물.",조단백 9.1%  조지방 6.3%  칼슘 0.6%  인 0.4%  수분 81%,"검류미함유,그레인프리,글루텐프리",85g,945 kcal/kg (81 kcal/캔),"소의 심장, 호키, 소고기","연령구분 키튼,어덜트,시니어,전연령 푸드타입 습식사료 중량 85g 주재료 소의 심장, 호키, 소고기 식단정보 검류미함유,그레인프리,글루텐프리 칼로리 945 kcal/kg (81 kcal/캔) 원산지/제조사 뉴질랜드/K9 Natural Foods Limited",뉴질랜드/K9 Natural Foods Limited,,https://cdn.purplesto.re/media/store/sale/main_image/deal_k9natural_cat_B008CF0304SS_thumb01.png
