uuid,category,brand,title,age,classification,content,nutrient,info,gram,calory,ingredient,detail,from_company,성분등록번호,img
144,고양이,노스웨스트 (NORTHWEST NATURALS),내추럴 동결건조 닭고기,"어덜트,시니어",동결건조 사료,"치킨, 치킨간, 계란, 켈프, 연어오일, 타우린",조단백 45.0%  조지방 15.0%  칼슘 1.7%  인 1.3%  수분 5.0%,"그레인프리,글루텐프리,비유전자변형",311g,"3,807 kcal/kg","치킨, 치킨간, 계란","연령구분 어덜트,시니어 푸드타입 동결건조 사료 중량 311g 주재료 치킨, 치킨간, 계란 식단정보 그레인프리,글루텐프리,비유전자변형 칼로리 3,807 kcal/kg 원산지/제조사 미국/North West Naturals",미국/North West Naturals,제 GGHA50228호,https://cdn.purplesto.re/media/store/sale/main_image/northwest_cat_B014CF08_thumb01.png
145,고양이,파미나 (FARMINA),퀴노아 유리너리 오리,"키튼,어덜트,시니어,전연령",건사료,"얼리지 않은 뼈를 제거한 오리(20%), 수분을 제거한 오리(20%), 완두콩 전분, 닭고기 지방, 퀴노아(8%), 수분을 제거한 달걀(5%), 수분을 제거한 청어(5%), 청어 오일, 건조 크렌베리(2.5%), 카모마일(2.5%), 프락토올리고당, 이스트 추출물(만난올리고당의 원료), 차전자피(0.3%), 탄산칼슘, 염화 칼륨, 건조 맥주효모, 소금, 비타민 A, 비타민 D3, 비타민 E, 아스코르브산(수용성 비타민 C), 나이아 신(수용성 비타민 B3), 판토텐산 칼슘(수용성 비타민 B5), 리보플라빈(수용성 비타민 B2), 피리독신 염산염(수용성 비타민 B6), 티아민(수용성 비타민 B1), 비오틴(수용성 비타민 H), 엽산(수용성 비타민 B9), 비타민 B12, 염화콜린, 베타카로틴, 아연 아미노산(메티오닌) 킬레이트, 망간 아미노산(메티오닌) 킬레이트, 철분 아미노산(글리신), 구리 아미노산(메티오닌) 킬레이트, DL- 메티오닌, 타우린 (2000mg/kg 이상), 알로에 베라겔, 녹차 추출물, 로즈마리 추출물, 혼합토코페롤(천연 항산화제)",조단백 33%  조지방 16.5%  칼슘 1%  인 0.9%  수분 8%,"그레인프리,글루텐프리,비유전자변형",1.5kg,"3,984 kcal/kg","얼리지 않은 뼈를 제거한 오리고기, 수분을 제거한 오리고기, 완두콩전분","연령구분 키튼,어덜트,시니어,전연령 푸드타입 건사료 중량 1.5kg 주재료 얼리지 않은 뼈를 제거한 오리고기, 수분을 제거한 오리고기, 완두콩전분 식단정보 그레인프리,글루텐프리,비유전자변형 칼로리 3,984 kcal/kg 원산지/제조사 이탈리아/RUSSO MANGIMI S.p.A",이탈리아/RUSSO MANGIMI S.p.A,제 KKGB10021호,https://cdn.purplesto.re/media/store/sale/main_image/farmina_cat_B039CF04_thumb01.png
146,고양이,로투스 (LOTUS),오븐베이크 그레인프리 정어리와 청어,"키튼,어덜트,시니어,전연령",건사료,"정어리, 청어, 청어 분말,완두콩, 렌틸콩, 메기 오일, 타피오카, 아마씨, 천연생선 맛, 완두콩 단백질, 비타민 E, 맥주 건조 효모, 프로피온산칼슘, 당근, 사과, 인산이칼슘, 염화 콜린, 황산 칼슘, 소금, 다시마, 시금치, 호박, 블루 베리, 타우린, 뉴질랜드 녹색 홍합, 유카 추출물, 이눌린,L- 아스코르빌 -2- 폴리인산염, 황산철, DL 메티오닌, 황산아연, 아연, 염화칼륨, 니아신, 망간, 황산구리, 구리, 비타민 A, 황산망간, 티아민, 판토텐산칼슘, 피리독신, 비오틴, 리보플라빈, 비타민 B12, 비타민 D3, 요오드산칼슘, 엽산, 아셀렌산나트륨, 로즈마리 추출물",조단백 34.2%  조지방 14.2%  칼슘 0.91%  인 0.72%  수분 10%,"단일육류단백질,그레인프리,글루텐프리,비유전자변형",2.2kg,"3,457 kcal/kg","정어리, 청어, 청어 분말","연령구분 키튼,어덜트,시니어,전연령 푸드타입 건사료 중량 2.2kg 주재료 정어리, 청어, 청어 분말 식단정보 단일육류단백질,그레인프리,글루텐프리,비유전자변형 칼로리 3,457 kcal/kg 원산지/제조사 캐나다/Bio Biscuit Inc.",캐나다/Bio Biscuit Inc.,제 VVHDR0017호,https://cdn.purplesto.re/media/store/sale/main_image/lotus_cat_B020CF05_thumb01.png
147,고양이,오픈팜 (OPENFARM),주식 블렌드 시식세트 ,"키튼,어덜트,시니어,전연령",건사료,"뼈를 발라낸 오리, 오리분말, 건조 계란, 완두콩, 완두분말, 타피오카, 렌틸콩, 병아리콩, 닭고기지방, 아마씨, 천연향, 염화나트륨, 염화콜린, 탄산칼슘, 건조 치커리뿌리, 인산, 염화칼륨, 비타민합제(비타민A, 비타민 D3, 비타민E, 나이아신, L-아스코빌-2-폴리인산, 티아민 모노니트레이트, d-판토텐산칼슘, 리보플라빈, 염산 피리독신, 베타카로틴, 엽산, 비오틴, 비타민 B12), 미량광물질류합제(아연단백질화합물, 철단백질 화합물, 구리 단백질화합물, 산화아연, 망간단백질화합물, 황산동, 요오드산칼슘, 황산제일철, 산화망간, 아셀렌산나트륨), 타우린, 건조 로즈마리",조단백 32%  조지방 17%  칼슘 1.1%  인 0.9%  수분 8%,"그레인프리,글루텐프리","7.2kg, 3.6kg, 1.3kg","4,222 kcal/kg","뼈를 발라낸 오리, 오리분말, 건조 계란","연령구분 키튼,어덜트,시니어,전연령 푸드타입 건사료 중량 7.2kg, 3.6kg, 1.3kg 주재료 뼈를 발라낸 오리, 오리분말, 건조 계란 식단정보 그레인프리,글루텐프리 칼로리 4,222 kcal/kg 원산지/제조사 캐나다/Petcurean Pet Nutrition Inc.",캐나다/Petcurean Pet Nutrition Inc.,제 서울-21912호,https://cdn.purplesto.re/media/store/sale/main_image/deal_openfarm_cat_B123CF1701SS_thumb01.png
148,고양이,지위픽 (ZIWI),주식캔 토끼&양고기 ,"키튼,어덜트,시니어,전연령",습식사료,"토끼고기, 수분, 양고기, 양 내장(폐, 간, 트라이프, 심장) 및 뼈, 산토끼 고기, 병아리콩, 뉴질랜드 녹색홍합, DL-메티오닌, 건 켈프, 미네랄(황산마그네슘, 아연아미노산, 망간아미노산, 구리아미노산), 비타민(비타민 E, 비타민 B1, 비타민 B6 염산염, 엽산, 비타민 D3), 타우린",조단백 13%  조지방 5%  칼슘 0.41%  인 0.32%  수분 76%,"검류미함유,그레인프리,글루텐프리",185g,"1,100 kcal/kg","토끼고기, 수분, 양고기","연령구분 키튼,어덜트,시니어,전연령 푸드타입 습식사료 중량 185g 주재료 토끼고기, 수분, 양고기 식단정보 검류미함유,그레인프리,글루텐프리 칼로리 1,100 kcal/kg 원산지/제조사 뉴질랜드/Ziwi Ltd",뉴질랜드/Ziwi Ltd,제 서울-15608호,https://cdn.purplesto.re/media/store/sale/main_image/deal_ziwipeak_cat_B046CF2504SS_thumb01.png
149,고양이,지위픽 (ZIWI),주식캔 토끼&양고기,"키튼,어덜트,시니어,전연령",습식사료,"토끼고기, 수분, 양고기, 양 내장(폐, 간, 트라이프, 심장) 및 뼈, 산토끼 고기, 병아리콩, 뉴질랜드 녹색홍합, DL-메티오닌, 건 켈프, 미네랄(황산마그네슘, 아연아미노산, 망간아미노산, 구리아미노산), 비타민(비타민 E, 비타민 B1, 비타민 B6 염산염, 엽산, 비타민 D3), 타우린",조단백 13%  조지방 5%  칼슘 0.41%  인 0.32%  수분 76%,"검류미함유,그레인프리,글루텐프리",185g,"1,100 kcal/kg","토끼고기, 수분, 양고기","연령구분 키튼,어덜트,시니어,전연령 푸드타입 습식사료 중량 185g 주재료 토끼고기, 수분, 양고기 식단정보 검류미함유,그레인프리,글루텐프리 칼로리 1,100 kcal/kg 원산지/제조사 뉴질랜드/Ziwi Ltd",뉴질랜드/Ziwi Ltd,제 서울-15608호,https://cdn.purplesto.re/media/store/sale/main_image/ziwipeak_cat_B046CF25_thumb01.png
150,고양이,게더 (GATHER),프리에이커 치킨 어덜트,"어덜트,시니어",건사료,"유기농 닭고기, 유기농 건조 닭고기, 유기농 완두콩, 렌틸콩, 닭지방, 유기농 아마씨, 천연닭고기향, 블루베리, 크랜베리, 계란껍질분말, 비타민합제(비타민 A, 비타민D3, 비타민E, 나이아신, L-아스코빌-2-폴리인산, 티아민 모노니트레이트, d-판토텐산칼슘, 리보플라빈, 염산피리독신, 엽산, 비오틴, 비타민B12), 미량광물질류합제(아연단백질화합분, 철단백질화합분, 구리단백질화합물, 망간단백질화합물, 요오드산칼슘, 아셀렌산나트륨), DL-메티오닌, 타우린, 건조 로즈마리",조단백 29%  조지방 15%  칼슘 1.4%  인 0.6%  수분 10%,"그레인프리,글루텐프리,비유전자변형","1.8kg, 3.6kg, 1kg","3,664 kcal/kg","유기농 닭, 유기농 완두콩, 렌즈콩","연령구분 어덜트,시니어 푸드타입 건사료 중량 1.8kg, 3.6kg, 1kg 주재료 유기농 닭, 유기농 완두콩, 렌즈콩 식단정보 그레인프리,글루텐프리,비유전자변형 칼로리 3,664 kcal/kg 원산지/제조사 캐나다/Petcurean Pet Nutrition Inc.",캐나다/Petcurean Pet Nutrition Inc.,제 서울-22065호,https://cdn.purplesto.re/media/store/sale/main_image/gather_cat_B009CF01_thumb01.png
151,고양이,헤일로 (HALO),센서티브 홀리스틱 씨푸드 메들리,"어덜트,시니어",건사료,"흰살생선, 연어, 전란, 귀리, 완두콩분말, 콩단백질, 보리, 계유, 감자단백질, 아마씨, 천연액상향미제(가수분해 가금류간, d-토코페롤(혼합형)), 완두콩식이섬유, 황산칼슘, 천연고형향미제(가수분해가금류간, d-토코페롤(혼합형)), 제이인산칼슘, 프로바이오틱(효모(사카로미세스세레비시아), 바실러스코아글란스), 건조블루베리, 건조크랜베리, 건조당근, 고구마분말, 소금, 이눌린, 비타민제합제(비타민A, 비타민D3, 비타민E, 비타민B12, 비오틴, 엽산, 니코틴산, 판토텐산, 피리독신, 리보플라빈, 티아민), 염화칼륨, 미량광물질류합제(아연, 철, 염화칼륨, 구리, 망간, 아셀렌산나트륨, 미네랄오일, 요오드산칼슘), 타우린, 비타민E, 천연산화방지제(d-토코페롤(혼합형), 로즈마리추출물), 비타민C",조단백 32.0%  조지방 16.0%  칼슘 0.6%  인 0.5%  수분 10.0%,비유전자변형,1.3kg,"3,760 kcal/kg","흰살생선, 연어, 전란","연령구분 어덜트,시니어 푸드타입 건사료 중량 1.3kg 주재료 흰살생선, 연어, 전란 식단정보 비유전자변형 칼로리 3,760 kcal/kg 원산지/제조사 미국/Halo pet",미국/Halo pet,4160000-034-2019-0001,https://cdn.purplesto.re/media/store/sale/main_image/halo_cat_B044CF04_thumb01.png
152,고양이,보레알 (BOREAL),주식캔 치킨&연어&오리,"어덜트,시니어",습식 사료,"치킨, 치킨육수, 연어, 오리, 완두콩, 강낭콩, 계란, 레시틴, 탄산칼슘, 아마씨, 콜린클로라이드, 일인산나트륨, 식물성오일, 소금, DL-메티오닌, 유카시데게라추출물, 완두콩섬유질, 블루베리, 블랙베리, 사과, 석류, 크랜베리, 타우린, L-아스코르빌-2-폴리포스페이트(비타민C의 공급원), 아연아미노산복합체, 비타민E, 황산제일철, 철아미노산복합체, 황산아연, 니아신, 티아민모노나이트레이트, 구리프로테인산염, 비타민A, 셀렌산나트륨, 황산망간, 망간아미노산복합체, D-칼슘판토테네이트, 피리독신염산염, 리보플라빈, 비오틴, 비타민D3, 비타민B12, 요오드산칼슘, 엽산",조단백 7.2%  조지방 6.75%  칼슘 0.2%  인 0.18%  수분 85%,"검류미함유,그레인프리,글루텐프리",80g,"1,050 kcal/kg","치킨, 치킨육수, 연어","연령구분 어덜트,시니어 푸드타입 습식 사료 중량 80g 주재료 치킨, 치킨육수, 연어 식단정보 검류미함유,그레인프리,글루텐프리 칼로리 1,050 kcal/kg 원산지/제조사 캐나다/Boreal Pet Foods.",캐나다/Boreal Pet Foods.,제 서울-20007호,https://cdn.purplesto.re/media/store/sale/main_image/boreal_cat_B050CF11_thumb01.png
153,고양이,캣츠파인푸드 (CATZ FINEFOOD),주식캔 퓨레 no.107 캥거루,"어덜트,시니어",습식사료,"캥거루, 육수, 미네랄, 보리지오일",조단백 8.2%  조지방 4.1%  칼슘 0.2%  인 0.15%  수분 90%,"검류미함유,그레인프리,글루텐프리,비유전자변형","200g, 400g",991 kcal/kg,"캥거루, 육수, 미네랄","연령구분 어덜트,시니어 푸드타입 습식사료 중량 200g, 400g 주재료 캥거루, 육수, 미네랄 식단정보 검류미함유,그레인프리,글루텐프리,비유전자변형 칼로리 991 kcal/kg 원산지/제조사 독일/Landguth Heimtiernahrung GmbH",독일/Landguth Heimtiernahrung GmbH,,https://cdn.purplesto.re/media/store/sale/main_image/catzfinefood_cat_B053CF08_thumb01.png
154,고양이,나우 (NOW), 그레인프리 피쉬 어덜트,"어덜트,시니어",건사료,"뼈를 발라낸 송어, 통건조란, 감자,완두콩, 천연맛, 카놀라유, 아마인, 코코넛오일, 뼈를 발라낸 연어, 뼈를 발라낸 청어, 탄산칼슘, 토마토, 알팔파, 사과, 당근, 고구마, 호박, 바나나, 블루베리, 크랜베리, 블랙베리, 석류, 파파야, 렌즈콩, 브로콜리, 말린 치커리뿌리, 인산, 염화나트륨, 염화칼륨, 염화콜린, 비타민합제(A, D3, E, C, B12 등), 미광량물질류합제(아연, 철, 구리 등), L-리진, L-카르티닌",조단백 30.0%  조지방 19.0%  칼슘 0.9%  인 0.5%  수분 10.0%,"그레인프리,글루텐프리",100g,"3,988 kcal/kg","뼈를 발라낸 송어, 통건조란, 감자","연령구분 어덜트,시니어 푸드타입 건사료 중량 100g 주재료 뼈를 발라낸 송어, 통건조란, 감자 식단정보 그레인프리,글루텐프리 칼로리 3,988 kcal/kg 원산지/제조사 캐나다/Petcurean Pet Nutrition Inc.",캐나다/Petcurean Pet Nutrition Inc.,제 서울-19594호,https://cdn.purplesto.re/media/store/sale/main_image/now_cat_B012CF04_thumb01.png
155,고양이,어플라우즈 (APPLAWS), 습식캔 참치와 새우,"키튼,어덜트,시니어,전연령",습식간식,"참치순살, 참치육수, 새우, 익힌쌀알",조단백 12.0% 조지방 4.0% 조섬유 2.0% 조회분 2.0% 수분 88.0%,검류미함유,-,430 kcal/kg (30kcal/캔),"참치순살, 참치육수, 새우","연령구분 키튼,어덜트,시니어,전연령 푸드타입 습식간식 중량 - 주재료 참치순살, 참치육수, 새우 식단정보 검류미함유 칼로리 430 kcal/kg (30kcal/캔) 원산지/제조사 태국/MPM Products",태국/MPM Products,제 서울 25030호,https://cdn.purplesto.re/media/store/sale/main_image/applaws_cat_B004CT42_thumb01.png
156,고양이,캣만두 (CATMANDOO),라이프 에센셜 연어 ,"키튼,어덜트,시니어,전연령",동결건조 간식,연어 100%,조단백 87.0% 조지방 5.0% 조섬유 7.0% 조회분 7.0% 수분 4.0%,"그레인프리,글루텐프리",57g,"약 3,330 kcal/kg",연어,"연령구분 키튼,어덜트,시니어,전연령 푸드타입 동결건조 간식 중량 57g 주재료 연어 식단정보 그레인프리,글루텐프리 칼로리 약 3,330 kcal/kg 원산지/제조사 미국/Cat-man-doo",미국/Cat-man-doo,제 99QOD0003호,https://cdn.purplesto.re/media/store/sale/main_image/deal_catmandoo_cat_B034CT0209ss_thumb01.png
157,고양이,로우즈 사시 (RAWZ SASHI),참치&호박,"키튼,어덜트,시니어,전연령",습식간식,"참치, 생선 육수, 호박, 타피오카 전분",조단백 11%  조지방 0.25%  조섬유 0.5%  조회분 1.0%  수분 87% ,"그레인프리,글루텐프리,음수량충전",50g,460 kcal/kg (23 kcal/파우치),"참치, 생선 육수, 호박","연령구분 키튼,어덜트,시니어,전연령 푸드타입 습식간식 중량 50g 주재료 참치, 생선 육수, 호박 식단정보 그레인프리,글루텐프리,음수량충전 칼로리 460 kcal/kg (23 kcal/파우치) 원산지/제조사 태국/Rawz Natural Pet Food",태국/Rawz Natural Pet Food,제 VVHDR0031호,https://cdn.purplesto.re/media/store/sale/main_image/rawssashi_cat_B133CT01_thumb01.png
158,고양이,핸들러 (HANDLER),매쉬 튜브 낚시대 세트 ,"퍼피,어덜트,시니어,전연령",동결건조 사료,"오리고기(뼈, 심장, 간포함), 호박, 코코넛오일,연어오일, 비타민E, 미량광물질단백질화합물(망간/셀레늄효모), 리보플라빈(비타민), 요오드산칼슘, 판토텐산칼슘(미네랄), 혼합토코페롤, 로즈마리추출물",조단백 52%  조지방 34%  칼슘 2%  인 1.5%  수분 3%,"단일육류단백질,그레인프리,글루텐프리","128g, 340g","4,700 kcal/kg","오리고기(뼈, 심장, 간포함), 호박, 코코넛오일","연령구분 퍼피,어덜트,시니어,전연령 푸드타입 동결건조 사료 중량 128g, 340g 주재료 오리고기(뼈, 심장, 간포함), 호박, 코코넛오일 식단정보 단일육류단백질,그레인프리,글루텐프리 칼로리 4,700 kcal/kg 원산지/제조사 미국/BIXBIPET",미국/BIXBIPET,CCC020024호,https://cdn.purplesto.re/media/store/sale/main_image/deal_handler_cat_B115CS0201SS_thumb01.png
159,고양이,그랜마메이스 (GRANDMAMAES),"그레인프리 연어, 유통기한 21년 09월 02일","키튼,어덜트,시니어,전연령",건사료,"연어, 연어가루, 완두콩, 계유, 병아리콩, 청어가루, 타피오카, 달걀, 렌틸콩, 완두단백, 아마씨가루, 메틸오닌, 염화콜린, 타우린, 크랜베리, 블루베리, 사과, 당근, 파슬리, 상추, 물냉이, 시금치, 샐러리, 라이신, 탄산칼슘, 제1인산염, 비타민합제, 건유산균류, 아연황산염, 킬레이트아연, 세레늄, 황산구리, 킬레이트망간, 니아신, 리보프라빈, 바이오틴, 킬레이트코발트, 요오드산칼슘, 엽산",조단백 31%  조지방 19%  칼슘 1.2%  인 0.8%  수분 10%,"그레인프리,글루텐프리,비유전자변형",2.7kg,"3,820 kcal/kg","연어, 연어가루, 완두콩","연령구분 키튼,어덜트,시니어,전연령 푸드타입 건사료 중량 2.7kg 주재료 연어, 연어가루, 완두콩 식단정보 그레인프리,글루텐프리,비유전자변형 칼로리 3,820 kcal/kg 원산지/제조사 미국/SOUTHERN TIER PET NUTRTION. USA",미국/SOUTHERN TIER PET NUTRTION. USA,EEGSB0043호,https://cdn.purplesto.re/media/store/sale/main_image/grandmamaes_cat_B120CF02_thumb01.png
160,고양이,보레알 (BOREAL),오리지널 그레인프리 칠면조&송어,"키튼,어덜트,시니어,전연령",건사료,"칠면조, 송어, 청어, 말린계란, 고구마, 메밀, 렌즈콩, 호박, 천연향, 아마씨, 치킨지방, 말린억새풀, 레시틴, 블루베리, 크랜베리, 사과, 시금치, 프로피온산칼슘, 삼인산나트륨, DL-메티오닌, 효모추출물, 치커리뿌리추출물, 타우린, 염화콜린, 소금, 말린켈프, L-라이신, L-트립토판, 푸마르산, 젖산, 구연산, 말산, 유카시데게라추출물, 백리향추출물, 산화아연, 황산제일철, 아연아미노산복합체, 철아미노산복합체, 니아신아미드, 산화망간, 비타민E, 비타민A, 칼슘판토텐산, 리보플라빈, 티아민모노니트레이트, 피리독신히드로클로라이드, 황산구리, 구리, 구리단백질, 망간아미노산복합체, 엽산, 비타민D3, 비타민B12, 비오틴, 요오드산칼슘, 셀렌산나트륨, 로즈마리추출물.",조단백 36%  조지방 16%  칼슘 1.8%  인 1.1%  수분 10%,"그레인프리,글루텐프리","2.2kg, 5.4kg","3,492 kcal/kg","칠면조, 송어, 청어","연령구분 키튼,어덜트,시니어,전연령 푸드타입 건사료 중량 2.2kg, 5.4kg 주재료 칠면조, 송어, 청어 식단정보 그레인프리,글루텐프리 칼로리 3,492 kcal/kg 원산지/제조사 캐나다/Boreal Pet Foods.",캐나다/Boreal Pet Foods.,,https://cdn.purplesto.re/media/store/sale/main_image/boreal_cat_B050CF03_thumb01.png
161,고양이,로우즈 (RAWZ),슈레디드 파우치 치킨 가슴살&치즈 ,"어덜트,시니어",습식사료,"닭고기, 닭고기 육수, 치즈, 타피오카 전분, 해바라기씨 오일, 염화칼슘, 염화칼륨, 소금, 염화콜린, 타우린, 말린 파슬리, 미네랄(철 아미노산 킬레이트, 망간 아미노산 킬레이트, 아연 아미노산 킬레이트, 요오드산 칼슘, 구리 아미노산 킬레이트, 마그네슘 아미노산 킬레이트, 소듐 셀레나이트), 비타민(비타민 A 보충제, 비타민 D3 보충제, 비타민 E 보충제, 비타민 B1 질산염, 리보플라빈 보충제, 피리독신 염산염, 비타민 B12 보충제, 니아신 보충제, d-칼슘 팬토테네이트, 아스코르브산 (비타민C의 공급원), 엽산, 비오틴)",조단백 14.56%  조지방 2.87%  칼슘 0.24%  인 0.14%  수분 82%,검류미함유,69g,869 kcal/kg (59 kcal/파우치),"닭고기, 닭고기 육수, 치즈","연령구분 어덜트,시니어 푸드타입 습식사료 중량 69g 주재료 닭고기, 닭고기 육수, 치즈 식단정보 검류미함유 칼로리 869 kcal/kg (59 kcal/파우치) 원산지/제조사 태국/Rawz Natural Pet Food",태국/Rawz Natural Pet Food,제 II6TM0009호,https://cdn.purplesto.re/media/store/sale/main_image/deal_rawz_cat_B019CF0302SS_thumb01.png
162,고양이,어플라우즈 (APPLAWS),습식캔 그레인프리 참치,"키튼,어덜트,시니어,전연령",습식간식,"참치순살, 참치육수",조단백 18.0% 조지방 5.0%,"검류미함유,그레인프리,글루텐프리",70g,724 kcal/kg (50.6 kcal/캔),"참치순살, 참치육수","연령구분 키튼,어덜트,시니어,전연령 푸드타입 습식간식 중량 70g 주재료 참치순살, 참치육수 식단정보 검류미함유,그레인프리,글루텐프리 칼로리 724 kcal/kg (50.6 kcal/캔) 원산지/제조사 태국/MPM Products",태국/MPM Products,제 서울 25132호,https://cdn.purplesto.re/media/store/sale/main_image/applaws_cat_B004CT45_thumb01.png
163,고양이,고! (GO!),핏프리 그레인프리 치킨칠면조오리,"키튼,어덜트,시니어,전연령",건사료,"닭고기, 칠면조, 오리, 송어, 완두콩, 감자, 타피오카, 연어오일, 타우린, 비타민합제(비타민A, D3, E, C 등), 미량광물질류합제(아연, 철, 구리 등), L-리진",조단백 45.0%  조지방 18.0%  칼슘 1.9%  인 1.6%  수분 10.0%,그레인프리,1.8kg,"4,298 kcal/kg","닭고기, 칠면조, 오리","연령구분 키튼,어덜트,시니어,전연령 푸드타입 건사료 중량 1.8kg 주재료 닭고기, 칠면조, 오리 식단정보 그레인프리 칼로리 4,298 kcal/kg 원산지/제조사 캐나다/Petcurean Pet Nutrition Inc.",캐나다/Petcurean Pet Nutrition Inc.,제 서울-19594호,https://cdn.purplesto.re/media/store/sale/main_image/go_cat_B010CF02_thumb01.png
164,고양이,베츠키친 (VET'S KITCHEN),어덜트 울트라 프레쉬 닭고기,"어덜트,시니어",건사료,"신선한 닭고기, 신선한 닭 살코기, 닭고기육수, 고구마, 맥주 효모, 비타민&미네랄 프리믹스, 치커리",조단백 37.0%  조지방 11.0%  칼슘 0.99%  인 0.66%  수분 9.0%,단일육류단백질,770g,"3,590 kcal/kg","신선한 닭고기, 신선한 닭살코기, 닭고기육수","연령구분 어덜트,시니어 푸드타입 건사료 중량 770g 주재료 신선한 닭고기, 신선한 닭살코기, 닭고기육수 식단정보 단일육류단백질 칼로리 3,590 kcal/kg 원산지/제조사 영국/Pet's Kitchen Ltd.",영국/Pet's Kitchen Ltd.,제 서울-20766호,https://cdn.purplesto.re/media/store/sale/main_image/vetskitchen_cat_B022CF01_thumb01.png
165,고양이,나우 (NOW),그레인프리 피쉬 어덜트,"어덜트,시니어",건사료,"뼈를 발라낸 송어, 통건조란, 감자,완두콩, 천연맛, 카놀라유, 아마인, 코코넛오일, 뼈를 발라낸 연어, 뼈를 발라낸 청어, 탄산칼슘, 토마토, 알팔파, 사과, 당근, 고구마, 호박, 바나나, 블루베리, 크랜베리, 블랙베리, 석류, 파파야, 렌즈콩, 브로콜리, 말린 치커리뿌리, 인산, 염화나트륨, 염화칼륨, 염화콜린, 비타민합제(A, D3, E, C, B12 등), 미광량물질류합제(아연, 철, 구리 등), L-리진, L-카르티닌",조단백 30.0%  조지방 19.0%  칼슘 0.9%  인 0.5%  수분 10.0%,"그레인프리,글루텐프리",1.8kg,"3,988 kcal/kg","뼈를 발라낸 송어, 통건조란, 감자","연령구분 어덜트,시니어 푸드타입 건사료 중량 1.8kg 주재료 뼈를 발라낸 송어, 통건조란, 감자 식단정보 그레인프리,글루텐프리 칼로리 3,988 kcal/kg 원산지/제조사 캐나다/Petcurean Pet Nutrition Inc.",캐나다/Petcurean Pet Nutrition Inc.,제 서울-19594호,https://cdn.purplesto.re/media/store/sale/main_image/now_cat_B012CF04_thumb01.png
